{
  "code": "IND-UT-127",
  "sector": "industrie",
  "family": "UT",
  "title": "IND-UT-127 v A25-2 après le 01-04-2017 : Système de transmission performant PDF – 109.65 Ko",
  "version": null,
  "document_version": null,
  "effective_date": null,
  "dates": {
    "arrete_date": null,
    "effective_date": null,
    "partie_a_effective_date": null,
    "end_date": null,
    "date_source": "unknown"
  },
  "scope": {
    "building_types": [],
    "operation_types": [],
    "energy_systems": []
  },
  "applicability": {
    "residential": false,
    "tertiary": false,
    "collective": false,
    "individual": false,
    "new_building": null,
    "existing_building": true,
    "metropolitan_france": null,
    "overseas": null
  },
  "systems": {
    "heating": false,
    "domestic_hot_water": false,
    "heat_pump": false,
    "boiler": false,
    "hybrid_system": false,
    "district_heating": false,
    "ventilation": false,
    "insulation": false,
    "regulation": false,
    "gtb": false
  },
  "eligibility_conditions": [
    {
      "text": "3. Conditions pour la délivrance de certificats",
      "source_file": "Industrie_IND/IND-UT-127 v A25-2 après le 01-04-2017_0.pdf",
      "page": null,
      "section_title": "eligibility",
      "quote": "3. Conditions pour la délivrance de certificats",
      "confidence": "low"
    }
  ],
  "technical_requirements": [],
  "required_documents": [
    {
      "text": "La preuve de la réalisation de l’opération mentionne :",
      "source_file": "Industrie_IND/IND-UT-127 v A25-2 après le 01-04-2017_0.pdf",
      "page": null,
      "section_title": "required_documents",
      "quote": "La preuve de la réalisation de l’opération mentionne :",
      "confidence": "low"
    },
    {
      "text": "Par dérogation aux points 2, 3 et 4 ci-dessus, la preuve de la réalisation de l’opération mentionne la mise en place",
      "source_file": "Industrie_IND/IND-UT-127 v A25-2 après le 01-04-2017_0.pdf",
      "page": null,
      "section_title": "required_documents",
      "quote": "Par dérogation aux points 2, 3 et 4 ci-dessus, la preuve de la réalisation de l’opération mentionne la mise en place",
      "confidence": "low"
    },
    {
      "text": "cas de la mise en place d’une transmission directe. Elle est complétée par un document issu du fabricant indiquant",
      "source_file": "Industrie_IND/IND-UT-127 v A25-2 après le 01-04-2017_0.pdf",
      "page": null,
      "section_title": "required_documents",
      "quote": "cas de la mise en place d’une transmission directe. Elle est complétée par un document issu du fabricant indiquant",
      "confidence": "low"
    },
    {
      "text": "(dentée) ou un système de transmission directe. Dans les deux cas, ce document précise la puissance électrique",
      "source_file": "Industrie_IND/IND-UT-127 v A25-2 après le 01-04-2017_0.pdf",
      "page": null,
      "section_title": "required_documents",
      "quote": "(dentée) ou un système de transmission directe. Dans les deux cas, ce document précise la puissance électrique",
      "confidence": "low"
    },
    {
      "text": "indiquée sur un document issu du fabricant du moteur.",
      "source_file": "Industrie_IND/IND-UT-127 v A25-2 après le 01-04-2017_0.pdf",
      "page": null,
      "section_title": "required_documents",
      "quote": "indiquée sur un document issu du fabricant du moteur.",
      "confidence": "low"
    }
  ],
  "attestation_fields": [],
  "control_points": [],
  "calculation": {
    "formula_text": "5. Montant de certificats en kWh cumac",
    "variables": [],
    "tables": []
  },
  "formulas": [
    {
      "text": "5. Montant de certificats en kWh cumac",
      "source_file": "Industrie_IND/IND-UT-127 v A25-2 après le 01-04-2017_0.pdf",
      "page": null,
      "section_title": "formula",
      "quote": "5. Montant de certificats en kWh cumac",
      "confidence": "low"
    },
    {
      "text": "Montant en kWh cumac par kW",
      "source_file": "Industrie_IND/IND-UT-127 v A25-2 après le 01-04-2017_0.pdf",
      "page": null,
      "section_title": "formula",
      "quote": "Montant en kWh cumac par kW",
      "confidence": "low"
    },
    {
      "text": "Montant en kWh cumac par kW",
      "source_file": "Industrie_IND/IND-UT-127 v A25-2 après le 01-04-2017_0.pdf",
      "page": null,
      "section_title": "formula",
      "quote": "Montant en kWh cumac par kW",
      "confidence": "low"
    }
  ],
  "zones": [],
  "bonifications": [],
  "site_data_requirements": [],
  "output_documents": {
    "note_dimensionnement_required": false,
    "dpt_required": null,
    "attestation_required": false,
    "photos_required": false,
    "manufacturer_datasheet_required": false
  },
  "risks": [
    {
      "risk": "Extraction automatique heuristique : verifier les champs metier avant usage operationnel.",
      "severity": "low",
      "source_file": "Industrie_IND/IND-UT-127 v A25-2 après le 01-04-2017_0.pdf"
    }
  ],
  "related_documents": [
    {
      "document_id": "IND-UT-127 v A25-2 après le 01-04-2017_0",
      "code": "IND-UT-127",
      "document_type": "fiche_principale",
      "title": "IND-UT-127 v A25-2 après le 01-04-2017 : Système de transmission performant PDF – 109.65 Ko",
      "path": "Industrie_IND/IND-UT-127 v A25-2 après le 01-04-2017_0.pdf",
      "source_url": "https://www.ecologie.gouv.fr/sites/default/files/documents/IND-UT-127%20v%20A25-2%20apr%C3%A8s%20le%2001-04-2017_0.pdf",
      "format": "pdf",
      "effective_date": null,
      "metadata": {}
    },
    {
      "document_id": "IND-UT-127 v A25-2 après le 01-04-2017 - Partie A",
      "code": "IND-UT-127",
      "document_type": "partie_a",
      "title": "IND-UT-127 v A25-2 après le 01-04-2017 - Partie A PDF – 105.5 Ko",
      "path": "Industrie_IND/IND-UT-127 v A25-2 après le 01-04-2017 - Partie A.pdf",
      "source_url": "https://www.ecologie.gouv.fr/sites/default/files/documents/IND-UT-127%20v%20A25-2%20apr%C3%A8s%20le%2001-04-2017%20-%20Partie%20A.pdf",
      "format": "pdf",
      "effective_date": null,
      "metadata": {}
    },
    {
      "document_id": "IND-UT-127 v A25-2 après le 01-04-2017 - Partie A à compter du 01-07-2026",
      "code": "IND-UT-127",
      "document_type": "partie_a",
      "title": "IND-UT-127 v A25-2 après le 01-04-2017 - Partie A à compter du 01-07-2026 PDF – 110.53 Ko",
      "path": "Industrie_IND/IND-UT-127 v A25-2 après le 01-04-2017 - Partie A à compter du 01-07-2026.pdf",
      "source_url": "https://www.ecologie.gouv.fr/sites/default/files/documents/IND-UT-127%20v%20A25-2%20apr%C3%A8s%20le%2001-04-2017%20-%20Partie%20A%20%C3%A0%20compter%20du%2001-07-2026.pdf",
      "format": "pdf",
      "effective_date": "2026-07-01",
      "metadata": {}
    }
  ],
  "source_files": [
    "Industrie_IND/IND-UT-127 v A25-2 après le 01-04-2017_0.pdf",
    "Industrie_IND/IND-UT-127 v A25-2 après le 01-04-2017 - Partie A.pdf",
    "Industrie_IND/IND-UT-127 v A25-2 après le 01-04-2017 - Partie A à compter du 01-07-2026.pdf"
  ],
  "extraction": {
    "status": "extracted",
    "tool": "scripts/build_indexes.py",
    "extracted_at": "2026-05-15T15:29:57.302629+00:00",
    "needs_human_review": false,
    "notes": null
  }
}