{
  "code": "IND-UT-129",
  "sector": "industrie",
  "family": "UT",
  "title": "IND-UT-129 v A32-3 : Presse à injecter tout électrique ou hybride PDF – 126.44 Ko",
  "version": null,
  "document_version": null,
  "effective_date": null,
  "dates": {
    "arrete_date": null,
    "effective_date": null,
    "partie_a_effective_date": null,
    "end_date": null,
    "date_source": "unknown"
  },
  "scope": {
    "building_types": [],
    "operation_types": [],
    "energy_systems": []
  },
  "applicability": {
    "residential": false,
    "tertiary": false,
    "collective": false,
    "individual": false,
    "new_building": null,
    "existing_building": true,
    "metropolitan_france": null,
    "overseas": null
  },
  "systems": {
    "heating": true,
    "domestic_hot_water": false,
    "heat_pump": false,
    "boiler": false,
    "hybrid_system": true,
    "district_heating": false,
    "ventilation": false,
    "insulation": false,
    "regulation": false,
    "gtb": false
  },
  "eligibility_conditions": [
    {
      "text": "3. Conditions pour la délivrance de certificats",
      "source_file": "Industrie_IND/IND-UT-129 v A32-3.pdf",
      "page": null,
      "section_title": "eligibility",
      "quote": "3. Conditions pour la délivrance de certificats",
      "confidence": "low"
    }
  ],
  "technical_requirements": [],
  "required_documents": [
    {
      "text": "La preuve de la réalisation de l’opération mentionne la mise en place d’une presse à injecter tout électrique ou d’une",
      "source_file": "Industrie_IND/IND-UT-129 v A32-3.pdf",
      "page": null,
      "section_title": "required_documents",
      "quote": "La preuve de la réalisation de l’opération mentionne la mise en place d’une presse à injecter tout électrique ou d’une",
      "confidence": "low"
    },
    {
      "text": "A défaut, la preuve de réalisation de l'opération mentionne la mise en place d'un équipement avec ses marque et",
      "source_file": "Industrie_IND/IND-UT-129 v A32-3.pdf",
      "page": null,
      "section_title": "required_documents",
      "quote": "A défaut, la preuve de réalisation de l'opération mentionne la mise en place d'un équipement avec ses marque et",
      "confidence": "low"
    },
    {
      "text": "référence et elle est complétée par un document issu du fabricant indiquant que l'équipement de marque et référence",
      "source_file": "Industrie_IND/IND-UT-129 v A32-3.pdf",
      "page": null,
      "section_title": "required_documents",
      "quote": "référence et elle est complétée par un document issu du fabricant indiquant que l'équipement de marque et référence",
      "confidence": "low"
    },
    {
      "text": "injecter tout électrique ou hybride, ce document précise la puissance électrique nominale de la presse.",
      "source_file": "Industrie_IND/IND-UT-129 v A32-3.pdf",
      "page": null,
      "section_title": "required_documents",
      "quote": "injecter tout électrique ou hybride, ce document précise la puissance électrique nominale de la presse.",
      "confidence": "low"
    },
    {
      "text": "défaut elle est fournie par un document issu du fabricant de la presse à injecter et détaillant les puissances des",
      "source_file": "Industrie_IND/IND-UT-129 v A32-3.pdf",
      "page": null,
      "section_title": "required_documents",
      "quote": "défaut elle est fournie par un document issu du fabricant de la presse à injecter et détaillant les puissances des",
      "confidence": "low"
    }
  ],
  "attestation_fields": [],
  "control_points": [],
  "calculation": {
    "formula_text": "5. Montant de certificats en kWh cumac",
    "variables": [],
    "tables": []
  },
  "formulas": [
    {
      "text": "5. Montant de certificats en kWh cumac",
      "source_file": "Industrie_IND/IND-UT-129 v A32-3.pdf",
      "page": null,
      "section_title": "formula",
      "quote": "5. Montant de certificats en kWh cumac",
      "confidence": "low"
    },
    {
      "text": "Montant en kWh",
      "source_file": "Industrie_IND/IND-UT-129 v A32-3.pdf",
      "page": null,
      "section_title": "formula",
      "quote": "Montant en kWh",
      "confidence": "low"
    },
    {
      "text": "cumac par kW",
      "source_file": "Industrie_IND/IND-UT-129 v A32-3.pdf",
      "page": null,
      "section_title": "formula",
      "quote": "cumac par kW",
      "confidence": "low"
    },
    {
      "text": "Montant en kWh",
      "source_file": "Industrie_IND/IND-UT-129 v A32-3.pdf",
      "page": null,
      "section_title": "formula",
      "quote": "Montant en kWh",
      "confidence": "low"
    },
    {
      "text": "cumac par kW",
      "source_file": "Industrie_IND/IND-UT-129 v A32-3.pdf",
      "page": null,
      "section_title": "formula",
      "quote": "cumac par kW",
      "confidence": "low"
    },
    {
      "text": "Montant en kWh",
      "source_file": "Industrie_IND/IND-UT-129 v A32-3.pdf",
      "page": null,
      "section_title": "formula",
      "quote": "Montant en kWh",
      "confidence": "low"
    },
    {
      "text": "cumac par kW",
      "source_file": "Industrie_IND/IND-UT-129 v A32-3.pdf",
      "page": null,
      "section_title": "formula",
      "quote": "cumac par kW",
      "confidence": "low"
    },
    {
      "text": "Montant en kWh",
      "source_file": "Industrie_IND/IND-UT-129 v A32-3.pdf",
      "page": null,
      "section_title": "formula",
      "quote": "Montant en kWh",
      "confidence": "low"
    },
    {
      "text": "cumac par kW",
      "source_file": "Industrie_IND/IND-UT-129 v A32-3.pdf",
      "page": null,
      "section_title": "formula",
      "quote": "cumac par kW",
      "confidence": "low"
    },
    {
      "text": "Montant en kWh",
      "source_file": "Industrie_IND/IND-UT-129 v A32-3.pdf",
      "page": null,
      "section_title": "formula",
      "quote": "Montant en kWh",
      "confidence": "low"
    },
    {
      "text": "cumac par kW",
      "source_file": "Industrie_IND/IND-UT-129 v A32-3.pdf",
      "page": null,
      "section_title": "formula",
      "quote": "cumac par kW",
      "confidence": "low"
    }
  ],
  "zones": [],
  "bonifications": [],
  "site_data_requirements": [],
  "output_documents": {
    "note_dimensionnement_required": false,
    "dpt_required": null,
    "attestation_required": false,
    "photos_required": false,
    "manufacturer_datasheet_required": false
  },
  "risks": [
    {
      "risk": "Extraction automatique heuristique : verifier les champs metier avant usage operationnel.",
      "severity": "low",
      "source_file": "Industrie_IND/IND-UT-129 v A32-3.pdf"
    }
  ],
  "related_documents": [
    {
      "document_id": "IND-UT-129 v A32-3",
      "code": "IND-UT-129",
      "document_type": "fiche_principale",
      "title": "IND-UT-129 v A32-3 : Presse à injecter tout électrique ou hybride PDF – 126.44 Ko",
      "path": "Industrie_IND/IND-UT-129 v A32-3.pdf",
      "source_url": "https://www.ecologie.gouv.fr/sites/default/files/documents/IND-UT-129%20v%20A32-3.pdf",
      "format": "pdf",
      "effective_date": null,
      "metadata": {}
    },
    {
      "document_id": "IND-UT-129 v A32-3 - Partie A_0",
      "code": "IND-UT-129",
      "document_type": "partie_a",
      "title": "IND-UT-129 v A32-3 - Partie A PDF – 111.27 Ko",
      "path": "Industrie_IND/IND-UT-129 v A32-3 - Partie A_0.pdf",
      "source_url": "https://www.ecologie.gouv.fr/sites/default/files/documents/IND-UT-129%20v%20A32-3%20-%20Partie%20A_0.pdf",
      "format": "pdf",
      "effective_date": null,
      "metadata": {}
    },
    {
      "document_id": "IND-UT-129 v A32-3 - Partie A à compter du 01-07-2026",
      "code": "IND-UT-129",
      "document_type": "partie_a",
      "title": "IND-UT-129 v A32-3 - Partie A à compter du 01-07-2026 PDF – 114.91 Ko",
      "path": "Industrie_IND/IND-UT-129 v A32-3 - Partie A à compter du 01-07-2026.pdf",
      "source_url": "https://www.ecologie.gouv.fr/sites/default/files/documents/IND-UT-129%20v%20A32-3%20-%20Partie%20A%20%C3%A0%20compter%20du%2001-07-2026.pdf",
      "format": "pdf",
      "effective_date": "2026-07-01",
      "metadata": {}
    }
  ],
  "source_files": [
    "Industrie_IND/IND-UT-129 v A32-3.pdf",
    "Industrie_IND/IND-UT-129 v A32-3 - Partie A_0.pdf",
    "Industrie_IND/IND-UT-129 v A32-3 - Partie A à compter du 01-07-2026.pdf"
  ],
  "extraction": {
    "status": "extracted",
    "tool": "scripts/build_indexes.py",
    "extracted_at": "2026-05-15T15:29:57.318670+00:00",
    "needs_human_review": false,
    "notes": null
  }
}