{
  "code": "AGRI-EQ-102",
  "sector": "agriculture",
  "family": "EQ",
  "title": "AGRI-EQ-102 vA65-2 à compter du 01-04-2025 : Double écran thermique PDF – 110.75 Ko",
  "version": "vA65-2",
  "document_version": "vA65-2",
  "effective_date": "2025-04-01",
  "dates": {
    "arrete_date": null,
    "effective_date": "2025-04-01",
    "partie_a_effective_date": null,
    "end_date": null,
    "date_source": "filename"
  },
  "scope": {
    "building_types": [],
    "operation_types": [],
    "energy_systems": []
  },
  "applicability": {
    "residential": false,
    "tertiary": false,
    "collective": false,
    "individual": false,
    "new_building": null,
    "existing_building": true,
    "metropolitan_france": null,
    "overseas": null
  },
  "systems": {
    "heating": false,
    "domestic_hot_water": false,
    "heat_pump": false,
    "boiler": false,
    "hybrid_system": false,
    "district_heating": false,
    "ventilation": false,
    "insulation": false,
    "regulation": false,
    "gtb": false
  },
  "eligibility_conditions": [
    {
      "text": "3. Conditions pour la délivrance de certificats",
      "source_file": "Agriculture_AGRI/AGRI-EQ-102 vA65-2 à compter du 01-04-2025_0.pdf",
      "page": null,
      "section_title": "eligibility",
      "quote": "3. Conditions pour la délivrance de certificats",
      "confidence": "low"
    }
  ],
  "technical_requirements": [],
  "required_documents": [
    {
      "text": "La preuve de la réalisation de l’opération mentionne, selon le cas, la mise en place d’un double écran thermique ou",
      "source_file": "Agriculture_AGRI/AGRI-EQ-102 vA65-2 à compter du 01-04-2025_0.pdf",
      "page": null,
      "section_title": "required_documents",
      "quote": "La preuve de la réalisation de l’opération mentionne, selon le cas, la mise en place d’un double écran thermique ou",
      "confidence": "low"
    },
    {
      "text": "A défaut, la preuve de réalisation de l’opération mentionne la mise en place d’un équipement avec ses marque et",
      "source_file": "Agriculture_AGRI/AGRI-EQ-102 vA65-2 à compter du 01-04-2025_0.pdf",
      "page": null,
      "section_title": "required_documents",
      "quote": "A défaut, la preuve de réalisation de l’opération mentionne la mise en place d’un équipement avec ses marque et",
      "confidence": "low"
    },
    {
      "text": "référence et elle est complétée par un document issu du fabricant indiquant que l’équipement de marque et référence",
      "source_file": "Agriculture_AGRI/AGRI-EQ-102 vA65-2 à compter du 01-04-2025_0.pdf",
      "page": null,
      "section_title": "required_documents",
      "quote": "référence et elle est complétée par un document issu du fabricant indiquant que l’équipement de marque et référence",
      "confidence": "low"
    }
  ],
  "attestation_fields": [],
  "control_points": [],
  "calculation": {
    "formula_text": "5. Montant de certificats en kWh cumac",
    "variables": [],
    "tables": []
  },
  "formulas": [
    {
      "text": "5. Montant de certificats en kWh cumac",
      "source_file": "Agriculture_AGRI/AGRI-EQ-102 vA65-2 à compter du 01-04-2025_0.pdf",
      "page": null,
      "section_title": "formula",
      "quote": "5. Montant de certificats en kWh cumac",
      "confidence": "low"
    },
    {
      "text": "Montant en kWh cumac",
      "source_file": "Agriculture_AGRI/AGRI-EQ-102 vA65-2 à compter du 01-04-2025_0.pdf",
      "page": null,
      "section_title": "formula",
      "quote": "Montant en kWh cumac",
      "confidence": "low"
    }
  ],
  "zones": [],
  "bonifications": [],
  "site_data_requirements": [],
  "output_documents": {
    "note_dimensionnement_required": false,
    "dpt_required": null,
    "attestation_required": false,
    "photos_required": false,
    "manufacturer_datasheet_required": false
  },
  "risks": [
    {
      "risk": "Extraction automatique heuristique : verifier les champs metier avant usage operationnel.",
      "severity": "low",
      "source_file": "Agriculture_AGRI/AGRI-EQ-102 vA65-2 à compter du 01-04-2025_0.pdf"
    }
  ],
  "related_documents": [
    {
      "document_id": "AGRI-EQ-102 vA65-2 à compter du 01-04-2025_0",
      "code": "AGRI-EQ-102",
      "document_type": "fiche_principale",
      "title": "AGRI-EQ-102 vA65-2 à compter du 01-04-2025 : Double écran thermique PDF – 110.75 Ko",
      "path": "Agriculture_AGRI/AGRI-EQ-102 vA65-2 à compter du 01-04-2025_0.pdf",
      "source_url": "https://www.ecologie.gouv.fr/sites/default/files/documents/AGRI-EQ-102%20vA65-2%20%C3%A0%20compter%20du%2001-04-2025_0.pdf",
      "format": "pdf",
      "effective_date": "2025-04-01",
      "metadata": {}
    },
    {
      "document_id": "AGRI-EQ-102 vA65-2 à compter du 01-04-2025 - Partie A",
      "code": "AGRI-EQ-102",
      "document_type": "partie_a",
      "title": "AGRI-EQ-102 vA65-2 à compter du 01-04-2025 - Partie A PDF – 103.18 Ko",
      "path": "Agriculture_AGRI/AGRI-EQ-102 vA65-2 à compter du 01-04-2025 - Partie A.pdf",
      "source_url": "https://www.ecologie.gouv.fr/sites/default/files/documents/AGRI-EQ-102%20vA65-2%20%C3%A0%20compter%20du%2001-04-2025%20-%20Partie%20A.pdf",
      "format": "pdf",
      "effective_date": "2025-04-01",
      "metadata": {}
    },
    {
      "document_id": "AGRI-EQ-102 vA65-2 à compter du 01-04-2025 - Partie A à compter du 01-07-2026",
      "code": "AGRI-EQ-102",
      "document_type": "partie_a",
      "title": "AGRI-EQ-102 vA65-2 à compter du 01-04-2025 - Partie A à compter du 01-07-2026 PDF – 106.06 Ko",
      "path": "Agriculture_AGRI/AGRI-EQ-102 vA65-2 à compter du 01-04-2025 - Partie A à compter du 01-07-2026.pdf",
      "source_url": "https://www.ecologie.gouv.fr/sites/default/files/documents/AGRI-EQ-102%20vA65-2%20%C3%A0%20compter%20du%2001-04-2025%20-%20Partie%20A%20%C3%A0%20compter%20du%2001-07-2026.pdf",
      "format": "pdf",
      "effective_date": "2025-04-01",
      "metadata": {}
    }
  ],
  "source_files": [
    "Agriculture_AGRI/AGRI-EQ-102 vA65-2 à compter du 01-04-2025_0.pdf",
    "Agriculture_AGRI/AGRI-EQ-102 vA65-2 à compter du 01-04-2025 - Partie A.pdf",
    "Agriculture_AGRI/AGRI-EQ-102 vA65-2 à compter du 01-04-2025 - Partie A à compter du 01-07-2026.pdf"
  ],
  "extraction": {
    "status": "extracted",
    "tool": "scripts/build_indexes.py",
    "extracted_at": "2026-05-15T15:29:56.748045+00:00",
    "needs_human_review": false,
    "notes": null
  }
}