{
  "code": "TRA-EQ-130",
  "sector": "transport",
  "family": "EQ",
  "title": "TRA-EQ-130 vA73-3 à compter du 01-09-2025 : Achat ou location d’un quadricycle électrique neuf PDF – 131.3 Ko",
  "version": "vA73-3",
  "document_version": "vA73-3",
  "effective_date": "2025-09-01",
  "dates": {
    "arrete_date": null,
    "effective_date": "2025-09-01",
    "partie_a_effective_date": null,
    "end_date": null,
    "date_source": "filename"
  },
  "scope": {
    "building_types": [],
    "operation_types": [],
    "energy_systems": []
  },
  "applicability": {
    "residential": false,
    "tertiary": false,
    "collective": false,
    "individual": false,
    "new_building": null,
    "existing_building": null,
    "metropolitan_france": null,
    "overseas": null
  },
  "systems": {
    "heating": false,
    "domestic_hot_water": false,
    "heat_pump": false,
    "boiler": false,
    "hybrid_system": false,
    "district_heating": false,
    "ventilation": false,
    "insulation": false,
    "regulation": false,
    "gtb": false
  },
  "eligibility_conditions": [
    {
      "text": "3. Conditions pour la délivrance de certificats",
      "source_file": "Transport_TRA/TRA-EQ-130 vA73-3 à compter du 01-09-2025.pdf",
      "page": null,
      "section_title": "eligibility",
      "quote": "3. Conditions pour la délivrance de certificats",
      "confidence": "low"
    },
    {
      "text": "l’arrêté du 9 février 2009 relatif aux modalités d'immatriculation des véhicules, est éligible à la présente fiche si",
      "source_file": "Transport_TRA/TRA-EQ-130 vA73-3 à compter du 01-09-2025.pdf",
      "page": null,
      "section_title": "eligibility",
      "quote": "l’arrêté du 9 février 2009 relatif aux modalités d'immatriculation des véhicules, est éligible à la présente fiche si",
      "confidence": "low"
    }
  ],
  "technical_requirements": [
    {
      "text": "- la copie du certificat provisoire ou définitif d’immatriculation définitive des véhicules achetés ou loués ;",
      "source_file": "Transport_TRA/TRA-EQ-130 vA73-3 à compter du 01-09-2025.pdf",
      "page": null,
      "section_title": "technical_requirements",
      "quote": "- la copie du certificat provisoire ou définitif d’immatriculation définitive des véhicules achetés ou loués ;",
      "confidence": "low"
    }
  ],
  "required_documents": [
    {
      "text": "La preuve de la réalisation de l’opération mentionne l’achat ou la location d’un (ou plusieurs) quadricycle(s)",
      "source_file": "Transport_TRA/TRA-EQ-130 vA73-3 à compter du 01-09-2025.pdf",
      "page": null,
      "section_title": "required_documents",
      "quote": "La preuve de la réalisation de l’opération mentionne l’achat ou la location d’un (ou plusieurs) quadricycle(s)",
      "confidence": "low"
    },
    {
      "text": "Les documents justificatifs spécifiques à l’opération sont les suivants :",
      "source_file": "Transport_TRA/TRA-EQ-130 vA73-3 à compter du 01-09-2025.pdf",
      "page": null,
      "section_title": "required_documents",
      "quote": "Les documents justificatifs spécifiques à l’opération sont les suivants :",
      "confidence": "low"
    }
  ],
  "attestation_fields": [],
  "control_points": [],
  "calculation": {
    "formula_text": "5. Montant de certificats en kWh cumac",
    "variables": [],
    "tables": []
  },
  "formulas": [
    {
      "text": "5. Montant de certificats en kWh cumac",
      "source_file": "Transport_TRA/TRA-EQ-130 vA73-3 à compter du 01-09-2025.pdf",
      "page": null,
      "section_title": "formula",
      "quote": "5. Montant de certificats en kWh cumac",
      "confidence": "low"
    },
    {
      "text": "Montant en kWh cumac",
      "source_file": "Transport_TRA/TRA-EQ-130 vA73-3 à compter du 01-09-2025.pdf",
      "page": null,
      "section_title": "formula",
      "quote": "Montant en kWh cumac",
      "confidence": "low"
    }
  ],
  "zones": [],
  "bonifications": [],
  "site_data_requirements": [],
  "output_documents": {
    "note_dimensionnement_required": false,
    "dpt_required": null,
    "attestation_required": false,
    "photos_required": false,
    "manufacturer_datasheet_required": false
  },
  "risks": [
    {
      "risk": "Extraction automatique heuristique : verifier les champs metier avant usage operationnel.",
      "severity": "low",
      "source_file": "Transport_TRA/TRA-EQ-130 vA73-3 à compter du 01-09-2025.pdf"
    }
  ],
  "related_documents": [
    {
      "document_id": "TRA-EQ-130 vA73-3 à compter du 01-09-2025",
      "code": "TRA-EQ-130",
      "document_type": "fiche_principale",
      "title": "TRA-EQ-130 vA73-3 à compter du 01-09-2025 : Achat ou location d’un quadricycle électrique neuf PDF – 131.3 Ko",
      "path": "Transport_TRA/TRA-EQ-130 vA73-3 à compter du 01-09-2025.pdf",
      "source_url": "https://www.ecologie.gouv.fr/sites/default/files/documents/TRA-EQ-130%20vA73-3%20%C3%A0%20compter%20du%2001-09-2025.pdf",
      "format": "pdf",
      "effective_date": "2025-09-01",
      "metadata": {}
    },
    {
      "document_id": "TRA-EQ-130 vA73-3 à compter du 01-09-2025 - Partie A",
      "code": "TRA-EQ-130",
      "document_type": "partie_a",
      "title": "TRA-EQ-130 vA73-3 à compter du 01-09-2025 - Partie A PDF – 91.37 Ko",
      "path": "Transport_TRA/TRA-EQ-130 vA73-3 à compter du 01-09-2025 - Partie A.pdf",
      "source_url": "https://www.ecologie.gouv.fr/sites/default/files/documents/TRA-EQ-130%20vA73-3%20%C3%A0%20compter%20du%2001-09-2025%20-%20Partie%20A.pdf",
      "format": "pdf",
      "effective_date": "2025-09-01",
      "metadata": {}
    },
    {
      "document_id": "TRA-EQ-130 vA73-3 à compter du 01-09-2025 - Partie A à compter du 01-07-2026",
      "code": "TRA-EQ-130",
      "document_type": "partie_a",
      "title": "TRA-EQ-130 vA73-3 à compter du 01-09-2025 - Partie A à compter du 01-07-2026 PDF – 95.74 Ko",
      "path": "Transport_TRA/TRA-EQ-130 vA73-3 à compter du 01-09-2025 - Partie A à compter du 01-07-2026.pdf",
      "source_url": "https://www.ecologie.gouv.fr/sites/default/files/documents/TRA-EQ-130%20vA73-3%20%C3%A0%20compter%20du%2001-09-2025%20-%20Partie%20A%20%C3%A0%20compter%20du%2001-07-2026.pdf",
      "format": "pdf",
      "effective_date": "2025-09-01",
      "metadata": {}
    },
    {
      "document_id": "TRA-EQ-130 vA73-3 à compter du 01-09-2025 - Annexe 2 à compter du 01-07-2025",
      "code": "TRA-EQ-130",
      "document_type": "annexe",
      "title": "TRA-EQ-130 vA73-3 à compter du 01-09-2025 - Annexe 2 à compter du 01-07-2025 PDF – 121.56 Ko",
      "path": "Transport_TRA/TRA-EQ-130 vA73-3 à compter du 01-09-2025 - Annexe 2 à compter du 01-07-2025.pdf",
      "source_url": "https://www.ecologie.gouv.fr/sites/default/files/documents/TRA-EQ-130%20vA73-3%20%C3%A0%20compter%20du%2001-09-2025%20-%20Annexe%202%20%C3%A0%20compter%20du%2001-07-2025.pdf",
      "format": "pdf",
      "effective_date": "2025-09-01",
      "metadata": {}
    },
    {
      "document_id": "TRA-EQ-130 vA73-3 à compter du 01-09-2025 - Annexe 2 à compter du 01-07-2026",
      "code": "TRA-EQ-130",
      "document_type": "annexe",
      "title": "TRA-EQ-130 vA73-3 à compter du 01-09-2025 - Annexe 2 à compter du 01-07-2026 PDF – 114.44 Ko",
      "path": "Transport_TRA/TRA-EQ-130 vA73-3 à compter du 01-09-2025 - Annexe 2 à compter du 01-07-2026.pdf",
      "source_url": "https://www.ecologie.gouv.fr/sites/default/files/documents/TRA-EQ-130%20vA73-3%20%C3%A0%20compter%20du%2001-09-2025%20-%20Annexe%202%20%C3%A0%20compter%20du%2001-07-2026.pdf",
      "format": "pdf",
      "effective_date": "2025-09-01",
      "metadata": {}
    },
    {
      "document_id": "TRA-EQ-130 vA73-3 Feuille récapitulative",
      "code": "TRA-EQ-130",
      "document_type": "feuille_recapitulative",
      "title": "TRA-EQ-130 vA73-3 Feuille récapitulative XLS – 23.5 Ko",
      "path": "Transport_TRA/TRA-EQ-130 vA73-3 Feuille récapitulative.xls",
      "source_url": "https://www.ecologie.gouv.fr/sites/default/files/documents/TRA-EQ-130%20vA73-3%20Feuille%20r%C3%A9capitulative.xls",
      "format": "xls",
      "effective_date": null,
      "metadata": {}
    }
  ],
  "source_files": [
    "Transport_TRA/TRA-EQ-130 vA73-3 à compter du 01-09-2025.pdf",
    "Transport_TRA/TRA-EQ-130 vA73-3 à compter du 01-09-2025 - Partie A.pdf",
    "Transport_TRA/TRA-EQ-130 vA73-3 à compter du 01-09-2025 - Partie A à compter du 01-07-2026.pdf",
    "Transport_TRA/TRA-EQ-130 vA73-3 à compter du 01-09-2025 - Annexe 2 à compter du 01-07-2025.pdf",
    "Transport_TRA/TRA-EQ-130 vA73-3 à compter du 01-09-2025 - Annexe 2 à compter du 01-07-2026.pdf",
    "Transport_TRA/TRA-EQ-130 vA73-3 Feuille récapitulative.xls"
  ],
  "extraction": {
    "status": "extracted",
    "tool": "scripts/build_indexes.py",
    "extracted_at": "2026-05-15T15:30:00.856694+00:00",
    "needs_human_review": false,
    "notes": null
  }
}