{
  "code": "TRA-EQ-125",
  "sector": "transport",
  "family": "EQ",
  "title": "TRA-EQ-125 vA40-2 à compter du 01-04-2022 : « Stop & Start » pour véhicules ferroviaires PDF – 106.21 Ko",
  "version": "vA40-2",
  "document_version": "vA40-2",
  "effective_date": "2022-04-01",
  "dates": {
    "arrete_date": null,
    "effective_date": "2022-04-01",
    "partie_a_effective_date": null,
    "end_date": null,
    "date_source": "filename"
  },
  "scope": {
    "building_types": [],
    "operation_types": [],
    "energy_systems": []
  },
  "applicability": {
    "residential": false,
    "tertiary": false,
    "collective": false,
    "individual": false,
    "new_building": null,
    "existing_building": null,
    "metropolitan_france": null,
    "overseas": null
  },
  "systems": {
    "heating": false,
    "domestic_hot_water": false,
    "heat_pump": false,
    "boiler": false,
    "hybrid_system": false,
    "district_heating": false,
    "ventilation": false,
    "insulation": false,
    "regulation": false,
    "gtb": false
  },
  "eligibility_conditions": [
    {
      "text": "le moteur au ralenti. L’arrêt automatique est programmé pour que ces conditions n’excèdent pas 15 minutes. Le",
      "source_file": "Transport_TRA/TRA-EQ-125 vA40-2 à compter du 01-04-2022_0.pdf",
      "page": null,
      "section_title": "eligibility",
      "quote": "le moteur au ralenti. L’arrêt automatique est programmé pour que ces conditions n’excèdent pas 15 minutes. Le",
      "confidence": "low"
    },
    {
      "text": "3. Conditions pour la délivrance de certificats",
      "source_file": "Transport_TRA/TRA-EQ-125 vA40-2 à compter du 01-04-2022_0.pdf",
      "page": null,
      "section_title": "eligibility",
      "quote": "3. Conditions pour la délivrance de certificats",
      "confidence": "low"
    }
  ],
  "technical_requirements": [
    {
      "text": "Une copie papier ou numérique lisible de cette photographie peut être acceptée.",
      "source_file": "Transport_TRA/TRA-EQ-125 vA40-2 à compter du 01-04-2022_0.pdf",
      "page": null,
      "section_title": "technical_requirements",
      "quote": "Une copie papier ou numérique lisible de cette photographie peut être acceptée.",
      "confidence": "low"
    }
  ],
  "required_documents": [
    {
      "text": "La preuve de la réalisation de l’opération mentionne l’installation d’un système « Stop & Start » neuf, ses marque",
      "source_file": "Transport_TRA/TRA-EQ-125 vA40-2 à compter du 01-04-2022_0.pdf",
      "page": null,
      "section_title": "required_documents",
      "quote": "La preuve de la réalisation de l’opération mentionne l’installation d’un système « Stop & Start » neuf, ses marque",
      "confidence": "low"
    },
    {
      "text": "Les documents justificatifs spécifiques à l’opération sont :",
      "source_file": "Transport_TRA/TRA-EQ-125 vA40-2 à compter du 01-04-2022_0.pdf",
      "page": null,
      "section_title": "required_documents",
      "quote": "Les documents justificatifs spécifiques à l’opération sont :",
      "confidence": "low"
    },
    {
      "text": "Le délai entre la date de la preuve de réalisation et la date d’achèvement de l’opération est au maximum de 18 mois.",
      "source_file": "Transport_TRA/TRA-EQ-125 vA40-2 à compter du 01-04-2022_0.pdf",
      "page": null,
      "section_title": "required_documents",
      "quote": "Le délai entre la date de la preuve de réalisation et la date d’achèvement de l’opération est au maximum de 18 mois.",
      "confidence": "low"
    }
  ],
  "attestation_fields": [],
  "control_points": [],
  "calculation": {
    "formula_text": "5. Montant de certificats en kWh cumac",
    "variables": [],
    "tables": []
  },
  "formulas": [
    {
      "text": "5. Montant de certificats en kWh cumac",
      "source_file": "Transport_TRA/TRA-EQ-125 vA40-2 à compter du 01-04-2022_0.pdf",
      "page": null,
      "section_title": "formula",
      "quote": "5. Montant de certificats en kWh cumac",
      "confidence": "low"
    },
    {
      "text": "Montant en kWh cumac",
      "source_file": "Transport_TRA/TRA-EQ-125 vA40-2 à compter du 01-04-2022_0.pdf",
      "page": null,
      "section_title": "formula",
      "quote": "Montant en kWh cumac",
      "confidence": "low"
    }
  ],
  "zones": [],
  "bonifications": [],
  "site_data_requirements": [],
  "output_documents": {
    "note_dimensionnement_required": false,
    "dpt_required": null,
    "attestation_required": false,
    "photos_required": true,
    "manufacturer_datasheet_required": false
  },
  "risks": [
    {
      "risk": "Extraction automatique heuristique : verifier les champs metier avant usage operationnel.",
      "severity": "low",
      "source_file": "Transport_TRA/TRA-EQ-125 vA40-2 à compter du 01-04-2022_0.pdf"
    }
  ],
  "related_documents": [
    {
      "document_id": "TRA-EQ-125 vA40-2 à compter du 01-04-2022_0",
      "code": "TRA-EQ-125",
      "document_type": "fiche_principale",
      "title": "TRA-EQ-125 vA40-2 à compter du 01-04-2022 : « Stop & Start » pour véhicules ferroviaires PDF – 106.21 Ko",
      "path": "Transport_TRA/TRA-EQ-125 vA40-2 à compter du 01-04-2022_0.pdf",
      "source_url": "https://www.ecologie.gouv.fr/sites/default/files/documents/TRA-EQ-125%20vA40-2%20%C3%A0%20compter%20du%2001-04-2022_0.pdf",
      "format": "pdf",
      "effective_date": "2022-04-01",
      "metadata": {}
    },
    {
      "document_id": "TRA-EQ-125 vA40-2 à compter du 01-04-2022 - Partie A",
      "code": "TRA-EQ-125",
      "document_type": "partie_a",
      "title": "TRA-EQ-125 vA40-2 à compter du 01-04-2022 - Partie A PDF – 94.07 Ko",
      "path": "Transport_TRA/TRA-EQ-125 vA40-2 à compter du 01-04-2022 - Partie A.pdf",
      "source_url": "https://www.ecologie.gouv.fr/sites/default/files/documents/TRA-EQ-125%20vA40-2%20%C3%A0%20compter%20du%2001-04-2022%20-%20Partie%20A.pdf",
      "format": "pdf",
      "effective_date": "2022-04-01",
      "metadata": {}
    },
    {
      "document_id": "TRA-EQ-125 vA40-2 à compter du 01-04-2022 - Partie A à compter du 01-07-2026",
      "code": "TRA-EQ-125",
      "document_type": "partie_a",
      "title": "TRA-EQ-125 vA40-2 à compter du 01-04-2022 - Partie A à compter du 01-07-2026 PDF – 98.95 Ko",
      "path": "Transport_TRA/TRA-EQ-125 vA40-2 à compter du 01-04-2022 - Partie A à compter du 01-07-2026.pdf",
      "source_url": "https://www.ecologie.gouv.fr/sites/default/files/documents/TRA-EQ-125%20vA40-2%20%C3%A0%20compter%20du%2001-04-2022%20-%20Partie%20A%20%C3%A0%20compter%20du%2001-07-2026.pdf",
      "format": "pdf",
      "effective_date": "2022-04-01",
      "metadata": {}
    },
    {
      "document_id": "TRA-EQ-125 vA40-2 à compter du 01-04-2022 - Annexe 2 à compter du 01-07-2025",
      "code": "TRA-EQ-125",
      "document_type": "annexe",
      "title": "TRA-EQ-125 vA40-2 à compter du 01-04-2022 - Annexe 2 à compter du 01-07-2025 PDF – 106.42 Ko",
      "path": "Transport_TRA/TRA-EQ-125 vA40-2 à compter du 01-04-2022 - Annexe 2 à compter du 01-07-2025.pdf",
      "source_url": "https://www.ecologie.gouv.fr/sites/default/files/documents/TRA-EQ-125%20vA40-2%20%C3%A0%20compter%20du%2001-04-2022%20-%20Annexe%202%20%C3%A0%20compter%20du%2001-07-2025.pdf",
      "format": "pdf",
      "effective_date": "2022-04-01",
      "metadata": {}
    },
    {
      "document_id": "TRA-EQ-125 vA40-2 à compter du 01-04-2022 - Annexe 2 à compter du 01-07-2026",
      "code": "TRA-EQ-125",
      "document_type": "annexe",
      "title": "TRA-EQ-125 vA40-2 à compter du 01-04-2022 - Annexe 2 à compter du 01-07-2026 PDF – 99.64 Ko",
      "path": "Transport_TRA/TRA-EQ-125 vA40-2 à compter du 01-04-2022 - Annexe 2 à compter du 01-07-2026.pdf",
      "source_url": "https://www.ecologie.gouv.fr/sites/default/files/documents/TRA-EQ-125%20vA40-2%20%C3%A0%20compter%20du%2001-04-2022%20-%20Annexe%202%20%C3%A0%20compter%20du%2001-07-2026.pdf",
      "format": "pdf",
      "effective_date": "2022-04-01",
      "metadata": {}
    }
  ],
  "source_files": [
    "Transport_TRA/TRA-EQ-125 vA40-2 à compter du 01-04-2022_0.pdf",
    "Transport_TRA/TRA-EQ-125 vA40-2 à compter du 01-04-2022 - Partie A.pdf",
    "Transport_TRA/TRA-EQ-125 vA40-2 à compter du 01-04-2022 - Partie A à compter du 01-07-2026.pdf",
    "Transport_TRA/TRA-EQ-125 vA40-2 à compter du 01-04-2022 - Annexe 2 à compter du 01-07-2025.pdf",
    "Transport_TRA/TRA-EQ-125 vA40-2 à compter du 01-04-2022 - Annexe 2 à compter du 01-07-2026.pdf"
  ],
  "extraction": {
    "status": "extracted",
    "tool": "scripts/build_indexes.py",
    "extracted_at": "2026-05-15T15:30:00.729367+00:00",
    "needs_human_review": false,
    "notes": null
  }
}